{
  "id": "MOD-006",
  "type": "module",
  "title": "Engineering change control",
  "status": "draft",
  "description": "Control transitions and current-view retirement using applicable authority, recorded provenance, and activity-specific resumption context.",
  "responsibilities": [
    "Record controlled transitions and their provenance.",
    "Determine applicable authority and preserve explicit human decision boundaries.",
    "Assess retirement dependencies and retain the context required to resume work."
  ],
  "owned_state": [
    "Change transition records, resumption context, and recorded authority/disposition references; external decision authority itself is not owned or invented by the module."
  ],
  "scope": {
    "includes": [
      "Controlled changes, authority assessment, retirement disposition, and resumption."
    ],
    "excludes": [
      "Automatic approval from a model edit, redefining governing policy, or claiming evidence-based satisfaction."
    ]
  },
  "provides": [],
  "consumes": [],
  "design_limits": [
    "This is a proposed responsibility boundary only. IR-003 ARs and baseline/storage/assurance interfaces are deferred.",
    "The IR-001 pilot preserves authority as a prerequisite and claims no executable authorization service."
  ],
  "sources": [
    {
      "source": "SRC-ARCHITECTURE-PILOT",
      "locator": "MOD-006",
      "basis": "Analyst-proposed responsibility boundary derived from the existing Function landscape. Assigned Functions remain authoritative for behavior; this record describes target architecture, not observed implementation."
    }
  ]
}
